{
  "schemaVersion": 4,
  "ownerModId": "Terrias",
  "participantKind": "Content",
  "packageId": "Terrias.SharedResources.V4",
  "packageVersion": 1,
  "resources": [
    {
      "moduleId": "Audio",
      "featureId": "Voice",
      "scopeType": "Role",
      "scopeId": "Terrias_wuna_wuna",
      "resourceId": "wuna.voice-pack",
      "kind": "Directory",
      "source": "Audio/WuNa",
      "priority": 100,
      "effectMode": "Replacement",
      "missingPolicy": "NativeFallback",
      "tags": [
        "role-pack",
        "voice"
      ],
      "writerId": "Terrias",
      "defaultEnabled": true,
      "archived": false,
      "scopeOwnerModId": "Terrias",
      "scopeAliases": [
        "wuna"
      ],
      "originKind": "ContentRegistered"
    },
    {
      "moduleId": "Audio",
      "featureId": "Voice",
      "scopeType": "Role",
      "scopeId": "Terrias_columbina_columbina",
      "resourceId": "columbina.voice-pack",
      "kind": "Directory",
      "source": "Audio/Columbina",
      "priority": 100,
      "effectMode": "Replacement",
      "missingPolicy": "NativeFallback",
      "tags": [
        "role-pack",
        "voice"
      ],
      "writerId": "Terrias",
      "defaultEnabled": true,
      "archived": false,
      "scopeOwnerModId": "Terrias",
      "scopeAliases": [
        "columbina"
      ],
      "originKind": "ContentRegistered"
    },
    {
      "moduleId": "CG",
      "featureId": "SkillCg",
      "scopeType": "Role",
      "scopeId": "Terrias_loneer_loneer",
      "resourceId": "loneer.morning-star-prayer",
      "kind": "File",
      "source": "CG/Loneer/Loneer_晨星祈愿.png",
      "fileName": "content.png",
      "priority": 20,
      "effectMode": "Additive",
      "missingPolicy": "Skip",
      "tags": [
        "skill-cg",
        "active-skill"
      ],
      "writerId": "Terrias",
      "defaultEnabled": true,
      "archived": false,
      "scopeOwnerModId": "Terrias",
      "scopeAliases": [
        "loneer"
      ],
      "originKind": "ContentRegistered"
    },
    {
      "moduleId": "CG",
      "featureId": "SkillCg",
      "scopeType": "Role",
      "scopeId": "Terrias_wuna_wuna",
      "resourceId": "wuna.white-sun-prayer",
      "kind": "File",
      "source": "CG/WuNa/WuNa_白曜圣祷.png",
      "fileName": "content.png",
      "priority": 20,
      "effectMode": "Additive",
      "missingPolicy": "Skip",
      "tags": [
        "skill-cg",
        "active-skill"
      ],
      "writerId": "Terrias",
      "defaultEnabled": true,
      "archived": false,
      "scopeOwnerModId": "Terrias",
      "scopeAliases": [
        "wuna"
      ],
      "originKind": "ContentRegistered"
    },
    {
      "moduleId": "CG",
      "featureId": "SkillCg",
      "scopeType": "Role",
      "scopeId": "Terrias_columbina_columbina",
      "resourceId": "columbina.homesickness",
      "kind": "File",
      "source": "CG/Columbina/Columbina_她的乡愁.png",
      "fileName": "content.png",
      "priority": 20,
      "effectMode": "Additive",
      "missingPolicy": "Skip",
      "tags": [
        "skill-cg",
        "active-skill"
      ],
      "writerId": "Terrias",
      "defaultEnabled": true,
      "archived": false,
      "scopeOwnerModId": "Terrias",
      "scopeAliases": [
        "columbina"
      ],
      "originKind": "ContentRegistered"
    },
    {
      "moduleId": "CG",
      "featureId": "CardUse",
      "scopeType": "Card",
      "scopeId": "Terrias_terrias_blazing_crown_collapse",
      "resourceId": "terrias.blazing-crown-collapse",
      "kind": "Directory",
      "source": "CG/WuNa/BlazingCrownCollapse",
      "priority": 30,
      "effectMode": "Additive",
      "missingPolicy": "Skip",
      "tags": [
        "card-use-cg",
        "sequence-cg"
      ],
      "writerId": "Terrias",
      "defaultEnabled": true,
      "archived": false,
      "scopeOwnerModId": "Terrias",
      "scopeAliases": [
        "collapse"
      ],
      "originKind": "ContentRegistered"
    },
    {
      "moduleId": "CG",
      "featureId": "Feast",
      "scopeType": "Role",
      "scopeId": "Terrias_loneer_loneer",
      "resourceId": "loneer.feast",
      "kind": "File",
      "source": "CG/Loneer/Loneer_美餐.png",
      "fileName": "content.png",
      "priority": 20,
      "effectMode": "Additive",
      "missingPolicy": "Skip",
      "tags": [
        "feast-cg"
      ],
      "writerId": "Terrias",
      "defaultEnabled": true,
      "archived": false,
      "scopeOwnerModId": "Terrias",
      "scopeAliases": [
        "loneer"
      ],
      "originKind": "ContentRegistered"
    },
    {
      "moduleId": "CG",
      "featureId": "Feast",
      "scopeType": "Role",
      "scopeId": "Terrias_wuna_wuna",
      "resourceId": "wuna.feast",
      "kind": "File",
      "source": "CG/WuNa/WuNa_美餐.png",
      "fileName": "content.png",
      "priority": 20,
      "effectMode": "Additive",
      "missingPolicy": "Skip",
      "tags": [
        "feast-cg"
      ],
      "writerId": "Terrias",
      "defaultEnabled": true,
      "archived": false,
      "scopeOwnerModId": "Terrias",
      "scopeAliases": [
        "wuna"
      ],
      "originKind": "ContentRegistered"
    },
    {
      "moduleId": "CG",
      "featureId": "Feast",
      "scopeType": "Role",
      "scopeId": "Terrias_columbina_columbina",
      "resourceId": "columbina.feast",
      "kind": "File",
      "source": "CG/Columbina/Columbina_美餐.png",
      "fileName": "content.png",
      "priority": 20,
      "effectMode": "Additive",
      "missingPolicy": "Skip",
      "tags": [
        "feast-cg"
      ],
      "writerId": "Terrias",
      "defaultEnabled": true,
      "archived": false,
      "scopeOwnerModId": "Terrias",
      "scopeAliases": [
        "columbina"
      ],
      "originKind": "ContentRegistered"
    }
  ],
  "defaults": [
    {
      "moduleId": "Audio",
      "featureId": "Voice",
      "scopeType": "Role",
      "scopeId": "Terrias_wuna_wuna",
      "profileId": "content-default",
      "enabled": true,
      "priority": 100,
      "resourceOwnerModId": "Terrias",
      "resourceId": "wuna.voice-pack"
    },
    {
      "moduleId": "Audio",
      "featureId": "Voice",
      "scopeType": "Role",
      "scopeId": "Terrias_columbina_columbina",
      "profileId": "content-default",
      "enabled": true,
      "priority": 100,
      "resourceOwnerModId": "Terrias",
      "resourceId": "columbina.voice-pack"
    },
    {
      "moduleId": "CG",
      "featureId": "SkillCg",
      "scopeType": "Role",
      "scopeId": "Terrias_loneer_loneer",
      "profileId": "content-default",
      "enabled": true,
      "priority": 20,
      "resourceOwnerModId": "Terrias",
      "resourceId": "loneer.morning-star-prayer"
    },
    {
      "moduleId": "CG",
      "featureId": "SkillCg",
      "scopeType": "Role",
      "scopeId": "Terrias_wuna_wuna",
      "profileId": "content-default",
      "enabled": true,
      "priority": 20,
      "resourceOwnerModId": "Terrias",
      "resourceId": "wuna.white-sun-prayer"
    },
    {
      "moduleId": "CG",
      "featureId": "SkillCg",
      "scopeType": "Role",
      "scopeId": "Terrias_columbina_columbina",
      "profileId": "content-default",
      "enabled": true,
      "priority": 20,
      "resourceOwnerModId": "Terrias",
      "resourceId": "columbina.homesickness"
    },
    {
      "moduleId": "CG",
      "featureId": "Feast",
      "scopeType": "Role",
      "scopeId": "Terrias_loneer_loneer",
      "profileId": "content-default",
      "enabled": true,
      "priority": 20,
      "resourceOwnerModId": "Terrias",
      "resourceId": "loneer.feast"
    },
    {
      "moduleId": "CG",
      "featureId": "Feast",
      "scopeType": "Role",
      "scopeId": "Terrias_wuna_wuna",
      "profileId": "content-default",
      "enabled": true,
      "priority": 20,
      "resourceOwnerModId": "Terrias",
      "resourceId": "wuna.feast"
    },
    {
      "moduleId": "CG",
      "featureId": "Feast",
      "scopeType": "Role",
      "scopeId": "Terrias_columbina_columbina",
      "profileId": "content-default",
      "enabled": true,
      "priority": 20,
      "resourceOwnerModId": "Terrias",
      "resourceId": "columbina.feast"
    }
  ],
  "packageSourceKind": "ModPackage"
}
